{
  "contract_version": "1.0",
  "text_id": "ck12-biology-photosynthesis-intro",
  "corpus_id": null,
  "text_summary": {
    "tokens": 141,
    "coverage_high": 0.6879,
    "coverage_lsw": 0.8085
  },
  "words": [
    {
      "headword": "light",
      "forms": [
        "light"
      ],
      "match_source": "self",
      "pos": "ADJ",
      "band": "HIGH",
      "frequency_count": null,
      "subject": "general",
      "grade_level": null,
      "relevance": 0.9773,
      "priority": 0.9887,
      "rank": 1,
      "count": 5
    },
    {
      "headword": "glucose",
      "forms": [
        "glucose"
      ],
      "match_source": "self",
      "pos": "NOUN",
      "band": "HIGH",
      "frequency_count": null,
      "subject": "general",
      "grade_level": null,
      "relevance": 0.9545,
      "priority": 0.9772,
      "rank": 2,
      "count": 4
    },
    {
      "headword": "chemical",
      "forms": [
        "chemical"
      ],
      "match_source": "self",
      "pos": "ADJ",
      "band": "HIGH",
      "frequency_count": null,
      "subject": "general",
      "grade_level": null,
      "relevance": 0.9318,
      "priority": 0.9659,
      "rank": 3,
      "count": 6
    },
    {
      "headword": "oxygen",
      "forms": [
        "oxygen"
      ],
      "match_source": "self",
      "pos": "NOUN",
      "band": "HIGH",
      "frequency_count": null,
      "subject": "general",
      "grade_level": null,
      "relevance": 0.8864,
      "priority": 0.9432,
      "rank": 4,
      "count": 4
    },
    {
      "headword": "produce",
      "forms": [
        "produce"
      ],
      "match_source": "self",
      "pos": "VERB",
      "band": "HIGH",
      "frequency_count": null,
      "subject": "general",
      "grade_level": null,
      "relevance": 0.8409,
      "priority": 0.9204,
      "rank": 5,
      "count": 2
    },
    {
      "headword": "photosynthesis",
      "forms": [
        "photosynthesis"
      ],
      "match_source": "self",
      "pos": "NOUN",
      "band": "HIGH",
      "frequency_count": null,
      "subject": "general",
      "grade_level": null,
      "relevance": 0.8182,
      "priority": 0.9091,
      "rank": 6,
      "count": 3
    },
    {
      "headword": "respiration",
      "forms": [
        "respiration"
      ],
      "match_source": "self",
      "pos": "NOUN",
      "band": "HIGH",
      "frequency_count": null,
      "subject": "general",
      "grade_level": null,
      "relevance": 0.7955,
      "priority": 0.8978,
      "rank": 7,
      "count": 3
    },
    {
      "headword": "burn",
      "forms": [
        "burns",
        "burning"
      ],
      "match_source": "lemma",
      "pos": "NOUN",
      "band": "HIGH",
      "frequency_count": null,
      "subject": "general",
      "grade_level": null,
      "relevance": 0.6818,
      "priority": 0.8409,
      "rank": 8,
      "count": 2
    },
    {
      "headword": "dioxide",
      "forms": [
        "dioxide"
      ],
      "match_source": "self",
      "pos": "NOUN",
      "band": "HIGH",
      "frequency_count": null,
      "subject": "general",
      "grade_level": null,
      "relevance": 0.6364,
      "priority": 0.8182,
      "rank": 9,
      "count": 1
    },
    {
      "headword": "energy",
      "forms": [
        "energy"
      ],
      "match_source": "self",
      "pos": "NOUN",
      "band": "MID",
      "frequency_count": null,
      "subject": "academic",
      "grade_level": null,
      "relevance": 1.0,
      "priority": 0.8,
      "rank": 10,
      "count": 8
    },
    {
      "headword": "reactant",
      "forms": [
        "reactants"
      ],
      "match_source": "lemma",
      "pos": "NOUN",
      "band": "HIGH",
      "frequency_count": null,
      "subject": "general",
      "grade_level": null,
      "relevance": 0.5909,
      "priority": 0.7954,
      "rank": 11,
      "count": 1
    },
    {
      "headword": "intense",
      "forms": [
        "intense"
      ],
      "match_source": "self",
      "pos": "ADJ",
      "band": "HIGH",
      "frequency_count": null,
      "subject": "general",
      "grade_level": null,
      "relevance": 0.5114,
      "priority": 0.7557,
      "rank": 12,
      "count": 1
    },
    {
      "headword": "release",
      "forms": [
        "releases",
        "release",
        "released"
      ],
      "match_source": "lemma",
      "pos": "VERB",
      "band": "MID",
      "frequency_count": null,
      "subject": "academic",
      "grade_level": null,
      "relevance": 0.9091,
      "priority": 0.7546,
      "rank": 13,
      "count": 4
    },
    {
      "headword": "life",
      "forms": [
        "life"
      ],
      "match_source": "self",
      "pos": "NOUN",
      "band": "HIGH",
      "frequency_count": null,
      "subject": "general",
      "grade_level": null,
      "relevance": 0.4545,
      "priority": 0.7272,
      "rank": 14,
      "count": 1
    },
    {
      "headword": "consider",
      "forms": [
        "considered"
      ],
      "match_source": "lemma",
      "pos": "VERB",
      "band": "HIGH",
      "frequency_count": null,
      "subject": "general",
      "grade_level": null,
      "relevance": 0.4318,
      "priority": 0.7159,
      "rank": 15,
      "count": 1
    },
    {
      "headword": "water",
      "forms": [
        "water"
      ],
      "match_source": "self",
      "pos": "NOUN",
      "band": "HIGH",
      "frequency_count": null,
      "subject": "general",
      "grade_level": null,
      "relevance": 0.4091,
      "priority": 0.7046,
      "rank": 16,
      "count": 1
    },
    {
      "headword": "combine",
      "forms": [
        "combine"
      ],
      "match_source": "self",
      "pos": "VERB",
      "band": "HIGH",
      "frequency_count": null,
      "subject": "general",
      "grade_level": null,
      "relevance": 0.3864,
      "priority": 0.6932,
      "rank": 17,
      "count": 1
    },
    {
      "headword": "reaction",
      "forms": [
        "reactions"
      ],
      "match_source": "lemma",
      "pos": "NOUN",
      "band": "MID",
      "frequency_count": null,
      "subject": "academic",
      "grade_level": null,
      "relevance": 0.75,
      "priority": 0.675,
      "rank": 18,
      "count": 2
    },
    {
      "headword": "small",
      "forms": [
        "small"
      ],
      "match_source": "self",
      "pos": "ADJ",
      "band": "HIGH",
      "frequency_count": null,
      "subject": "general",
      "grade_level": null,
      "relevance": 0.3409,
      "priority": 0.6704,
      "rank": 19,
      "count": 1
    },
    {
      "headword": "form",
      "forms": [
        "form"
      ],
      "match_source": "self",
      "pos": "VERB",
      "band": "HIGH",
      "frequency_count": null,
      "subject": "general",
      "grade_level": null,
      "relevance": 0.3182,
      "priority": 0.6591,
      "rank": 20,
      "count": 1
    },
    {
      "headword": "atmosphere",
      "forms": [
        "atmosphere"
      ],
      "match_source": "self",
      "pos": "NOUN",
      "band": "HIGH",
      "frequency_count": null,
      "subject": "general",
      "grade_level": null,
      "relevance": 0.2955,
      "priority": 0.6478,
      "rank": 21,
      "count": 2
    },
    {
      "headword": "type",
      "forms": [
        "types"
      ],
      "match_source": "lemma",
      "pos": "NOUN",
      "band": "HIGH",
      "frequency_count": null,
      "subject": "general",
      "grade_level": null,
      "relevance": 0.2727,
      "priority": 0.6363,
      "rank": 22,
      "count": 1
    },
    {
      "headword": "involve",
      "forms": [
        "involves"
      ],
      "match_source": "lemma",
      "pos": "VERB",
      "band": "MID",
      "frequency_count": null,
      "subject": "academic",
      "grade_level": null,
      "relevance": 0.6136,
      "priority": 0.6068,
      "rank": 23,
      "count": 2
    },
    {
      "headword": "waste",
      "forms": [
        "waste"
      ],
      "match_source": "self",
      "pos": "NOUN",
      "band": "HIGH",
      "frequency_count": null,
      "subject": "general",
      "grade_level": null,
      "relevance": 0.2045,
      "priority": 0.6022,
      "rank": 24,
      "count": 1
    },
    {
      "headword": "environment",
      "forms": [
        "environment"
      ],
      "match_source": "self",
      "pos": "NOUN",
      "band": "HIGH",
      "frequency_count": null,
      "subject": "general",
      "grade_level": null,
      "relevance": 0.1818,
      "priority": 0.5909,
      "rank": 25,
      "count": 1
    },
    {
      "headword": "use",
      "forms": [
        "using",
        "uses"
      ],
      "match_source": "lemma",
      "pos": "VERB",
      "band": "HIGH",
      "frequency_count": null,
      "subject": "general",
      "grade_level": null,
      "relevance": 0.1477,
      "priority": 0.5738,
      "rank": 26,
      "count": 2
    },
    {
      "headword": "molecule",
      "forms": [
        "molecules"
      ],
      "match_source": "lemma",
      "pos": "NOUN",
      "band": "HIGH",
      "frequency_count": null,
      "subject": "general",
      "grade_level": null,
      "relevance": 0.1477,
      "priority": 0.5738,
      "rank": 27,
      "count": 1
    },
    {
      "headword": "change",
      "forms": [
        "changes"
      ],
      "match_source": "lemma",
      "pos": "VERB",
      "band": "HIGH",
      "frequency_count": null,
      "subject": "general",
      "grade_level": null,
      "relevance": 0.0455,
      "priority": 0.5228,
      "rank": 28,
      "count": 1
    },
    {
      "headword": "product",
      "forms": [
        "product"
      ],
      "match_source": "self",
      "pos": "NOUN",
      "band": "HIGH",
      "frequency_count": null,
      "subject": "general",
      "grade_level": null,
      "relevance": 0.0227,
      "priority": 0.5113,
      "rank": 29,
      "count": 1
    },
    {
      "headword": "earth",
      "forms": [